{"evaluator":"korean-cs-ops","score":81,"decision":"HOLD","hard_gate_failures":["Claude runtime output is unavailable due to HTTP 429, so cross-runtime semantic parity cannot be assessed and GO is blocked."],"strengths":["Codex fixture-only results consistently preserve provider/product boundaries, including rejecting Kakao chatbot-to-ConsultTalk overclaiming.","The evaluated behavior requires redaction, canonical identity, exact idempotent dedupe, conflict dead-lettering, and accepted-versus-delivered separation.","No external write is reported across the canonical or repeated-anchor semantic results; scoped approval remains required."],"gaps":["This is fixture-only semantic evaluation, not provider E2E, real installation, or production-readiness evidence.","No real provider authentication, paid capability, recovery/reconciliation, or test-account round-trip was evidenced.","Claude parity, installation, discovery, and invocation are unverified.","The requested eval/skill-evaluation-plan.md was absent; docs/skill-evaluation-plan.md was reviewed as the available plan."],"coverage_limit":"Reviewed the available plan, expected behaviors, and Codex canonical (30) plus repeated-anchor (15) result summaries only. No network, credentials, external writes, generated-artifact E2E, or production claims were assessed."}
