{"evaluator":"Senior PM/CPO product-rigor evaluator","score":35,"decision":"NO_GO","hard_gate_failures":["Both submitted Codex run envelopes are invalid against eval/runtime-output.schema.json: undeclared top-level metadata violates additionalProperties=false. Their self-reported pass verdicts therefore cannot count as schema-valid completed evaluation artifacts.","Claude runtime evidence is unavailable due to HTTP 429, so the required cross-runtime semantic-parity gate cannot be evaluated and GO is prohibited."],"strengths":["The Codex semantic assessments consistently preserve the intended rigor: unknown baselines, counter-metrics, counterevidence, human review, approval boundaries, and non-overclaiming connector scope.","The repeated Codex anchor assessments are internally stable, and the submitted records consistently declare no external writes."],"gaps":["This is fixture-only semantic assessment, not generated-artifact E2E; it does not demonstrate artifact lineage, deterministic validation, or user task completion.","The records do not provide the required raw-output location, deterministic-validator result, or evaluator score record, preventing auditability of the claimed passes.","No Claude execution exists; do not infer runtime parity, plugin installation, provider behavior, or production readiness."],"coverage_limit":"Fresh read-only review limited to the specified plan, expected-behavior rules, and two Codex fixture-only run records; no network, credentials, generated-artifact inspection, provider E2E, or production validation was performed."}
