{"evaluator":"Primary-user evaluator — Korean AI-native SaaS founder/product lead","score":62,"decision":"HOLD","hard_gate_failures":["Claude runtime output is unavailable; cross-runtime semantic parity cannot be assessed and GO is blocked.","The available Codex records are fixture-only semantic assertions, not generated-artifact E2E evidence with deterministic validation.","Real plugin installation, provider integration, and production readiness are unverified."],"strengths":["All planned workflow areas are represented with safe, concrete next actions.","The Codex record consistently preserves approval, evidence, privacy, unknown-state, and provider-boundary language.","Repeated anchor summaries are internally consistent."],"gaps":["No raw generated artifacts, tool traces, validator results, or task-success evidence are present for primary-user usability review.","No Claude result exists because the monthly-spend-limit HTTP 429 prevented execution.","No evidence supports Codex/Claude parity or operational claims beyond fixture-only semantic evaluation."],"coverage_limit":"Read-only review of the supplied formal-evaluation documents and Codex semantic records only; no fixture identifiers, network, credentials, artifact execution, plugin installation, provider E2E, or production verification were used."}
