{"evaluator":"Cross-runtime evaluator: Agent Skills portability engineer","score":38,"decision":"HOLD","hard_gate_failures":["Claude runtime evidence is unavailable due to HTTP 429, so cross-runtime semantic parity, Claude installation, discovery, explicit invocation, artifact parity, and path/tool portability cannot be evaluated; GO is blocked."],"strengths":["The Codex fixture-only read-only record covers the complete canonical set across all specialist skills and the orchestrator, with no asserted external writes or hard-gate violations.","The repeated Codex anchor record is semantically stable across its recorded repetitions.","The evaluation plan and expected behaviors correctly require raw outputs, generated artifacts, deterministic validation, and runtime-specific evidence rather than relying on static review alone."],"gaps":["The Codex files are semantic result summaries, not generated-artifact E2E evidence; they do not prove schema/cross-reference validation, raw-output capture, or actual artifact lineage.","Neither supplied Codex record proves real plugin installation, skill discovery, explicit invocation, or runtime path portability.","No Claude output exists, so parity cannot be inferred from the Codex-only result.","Fixture-only read-only evidence cannot establish provider E2E or production readiness."],"coverage_limit":"Fresh read-only review of the requested local plan, expected behaviors, and Codex summary records only. No network, credentials, writes, runtime execution, installation check, provider E2E, production check, or Claude/Codex parity inference was performed."}
